search-results__item-image href,search-results__item-image src,similar-list__item-position,group,group href,h2,search-results__item-description,search-results__item-link href 2,mini-ingredients__link href,mini-ingredients__image src,mini-ingredients__link href 2,mini-ingredients__image src 2,item-location href,item-location,score-text--na,mini-ingredients__link href 3,mini-ingredients__image src 3,mini-ingredients__link href 4,mini-ingredients__image src 4,mini-ingredients__link href 5,mini-ingredients__image src 5,mini-ingredients__link href 6,mini-ingredients__image src 6
https://www.tasteatlas.com/fufu,https://cdn.tasteatlas.com//images/dishes/f189408c715349a891af42809e22b4a9.jpg?mw=660,1,Side Dish,https://www.tasteatlas.com/Sides,Fufu,"Fufu is very difficult to make, a process that starts by pounding cassava and unripe plantains together with a big wooden pole and mashing them while adding water. As it needs to be vigorously stirred, it usually takes two people to make it - one ...",https://www.tasteatlas.com/fufu/wheretoeat,https://www.tasteatlas.com/Plantains,https://cdn.tasteatlas.com/images/ingredientgroups/5bddeceb27324bafa35ead9958fce998.png?h=120&w=120,https://www.tasteatlas.com/cassava,https://cdn.tasteatlas.com/images/dishes/7de3408e3fa643339babc0a97f863500.png?h=120&w=120,,,,,,,,,,,
https://www.tasteatlas.com/waakye,https://cdn.tasteatlas.com//images/dishes/3366ea6f04784e3688f1ee1d393294fa.jpg?mw=660,2,Rice Dish,https://www.tasteatlas.com/Rice-dishes,Waakye,"Although it originated in northern parts of Ghana, the rice-and-bean-based dish known as waakye is today consumed on a national level. Whether it's eaten for breakfast or lunch, this dish can be made as rich and as filling as one likes by adding a...",https://www.tasteatlas.com/waakye/wheretoeat,,,,,https://www.tasteatlas.com/northern-region-ghana,Northern Region,n/a,,,,,,,,
https://www.tasteatlas.com/red-red,https://cdn.tasteatlas.com//images/dishes/beada8969d314075ae942ca030feed65.jpg?mw=660,3,Stew,https://www.tasteatlas.com/Stews,Red red,"Red red is a popular Ghanaian stew consisting of beans, red palm oil, tomato paste, and flavorings such as garlic, ginger, chili, and onions. Some cooks like to add meat or fish broth into the stew, but it is completely optional. The stew is tradi...",https://www.tasteatlas.com/red-red/wheretoeat,,,,,,,n/a,,,,,,,,
https://www.tasteatlas.com/garden-egg-stew,https://www.tasteatlas.com/content/layout/images/thumbnail-no-photo-1.jpg,4,Stew,https://www.tasteatlas.com/Stews,Garden Egg Stew,"Garden egg stew is a popular Ghanaian dish featuring African eggplant, or garden egg as its main ingredient. Although the eggplant is a fruit, it is prepared as a vegetable in this stew, combined with tomatoes, onions, peppers, palm oil, dried fis...",https://www.tasteatlas.com/garden-egg-stew/wheretoeat,,,,,,,n/a,,,,,,,,
https://www.tasteatlas.com/kelewele,https://cdn.tasteatlas.com//images/dishes/afc452e0dac14233bc5fdf6bec33ef1e.jpg?mw=660,5,Side Dish,https://www.tasteatlas.com/Sides,Kelewele,"Kelewele is a flavorful Ghanaian dish consisting of deep-fried plantain chunks that are usually combined with salt, ginger, and hot peppers. It is usually served as an accompaniment to bean stews or rice dishes, although kelewele is also often sol...",https://www.tasteatlas.com/kelewele/wheretoeat,,,,,,,n/a,,,,,,,,
https://www.tasteatlas.com/kokonte,https://cdn.tasteatlas.com//images/dishes/67d8baa08eed4fffbdfc9ed0ad4f6516.jpg?mw=660,6,Stew,https://www.tasteatlas.com/Stews,Kokonte,"Kokonte is a stew that is popular throughout Ghana and Togo, usually consisting of pounded, dried cassava or yam, water, and salt. After the dish is cooked, it ranges in color from light brown to black, depending on how the cassava was dried. Some...",https://www.tasteatlas.com/kokonte/wheretoeat,https://www.tasteatlas.com/cassava,https://cdn.tasteatlas.com/images/dishes/7de3408e3fa643339babc0a97f863500.png?h=120&w=120,https://www.tasteatlas.com/yams,https://cdn.tasteatlas.com/images/ingredientgroups/a13c5e129e9248b1b643b5e2a65df4e7.png?h=120&w=120,,,n/a,https://www.tasteatlas.com/Salt,https://cdn.tasteatlas.com/images/ingredientgroups/812de2786a274b7e85a4c54cc0fb40d2.png?h=120&w=120,,,,,,
https://www.tasteatlas.com/palm-nut-soup,https://cdn.tasteatlas.com//images/dishes/583c1cbdf17a4e6ca995e1884d8d27bc.jpg?mw=660,7,Soup,https://www.tasteatlas.com/Soups,Palm Nut Soup,"Palm nut soup is a hearty Ghanaian dish consisting of palm nut pulp, water, fish or meat, tomatoes, onions, and flavorings such as pepper, salt, garlic, and chili peppers. The combination of these ingredients is cooked until it develops a thick, s...",https://www.tasteatlas.com/palm-nut-soup/wheretoeat,https://www.tasteatlas.com/crabs,https://cdn.tasteatlas.com/images/ingredientgroups/37e8f7030f474704ac241bb0695a92f9.png?h=120&w=120,https://www.tasteatlas.com/Tomatoes,https://cdn.tasteatlas.com/images/ingredientgroups/72ddcc5fa8d7439d9f190499aa559132.png?h=120&w=120,,,n/a,https://www.tasteatlas.com/Onions,https://cdn.tasteatlas.com/images/ingredientgroups/bf73aa24e1b745988f43388bbdd27322.png?h=120&w=120,https://www.tasteatlas.com/garlic,https://cdn.tasteatlas.com/images/ingredientgroups/5863714d901146c094f8228eb52c1fcb.png?h=120&w=120,https://www.tasteatlas.com/Hot-peppers,https://cdn.tasteatlas.com/images/ingredientgroups/e02c316cda454fff9c282a56a480b458.png?h=120&w=120,https://www.tasteatlas.com/Okras,https://cdn.tasteatlas.com/images/ingredientgroups/3e3df0ccbd2442e19dbf2177d5c5c616.png?h=120&w=120
https://www.tasteatlas.com/kontomire-soup,https://www.tasteatlas.com/content/layout/images/thumbnail-no-photo-1.jpg,8,Soup,https://www.tasteatlas.com/Soups,Kontomire Soup,"Kontomire soup or  (green green) is a flavorful Ghanaian soup made from cocoyam leaves, smoked fish, mushrooms, and snails. Cocoyam leaves give the soup its characteristical green color. The soup is a traditional dish of the Ak...",https://www.tasteatlas.com/kontomire-soup/wheretoeat,,,,,,,n/a,,,,,,,,
https://www.tasteatlas.com/plakali,https://www.tasteatlas.com/content/layout/images/thumbnail-no-photo-4.jpg,9,Side Dish,https://www.tasteatlas.com/Sides,Plakali,Plakali is a traditional Ghanaian and Ivorian dish characterized by its starchy and sticky texture. It is made by steaming and pounding cassava roots. The dish might often taste sour due to the fermentation of cassava roots before cooking. Plakali...,https://www.tasteatlas.com/plakali/wheretoeat,,,,,,,n/a,,,,,,,,
https://www.tasteatlas.com/chichinga,https://www.tasteatlas.com/content/layout/images/thumbnail-no-photo-2.jpg,10,Street Food,https://www.tasteatlas.com/Street-food,Chichinga,"Chichinga is a popular Ghanaian street food item consisting of skewered and grilled meat that is rubbed with a spice mix known as . Suya is made with peanuts, ground spices, and hot chili peppers. The name of the dish is a translitera...",https://www.tasteatlas.com/chichinga/wheretoeat,,,,,,,n/a,,,,,,,,
https://www.tasteatlas.com/banku,https://cdn.tasteatlas.com//images/dishes/283d062368be45138a9c9b0199d62a43.jpg?mw=660,11,Side Dish,https://www.tasteatlas.com/Sides,Banku,"Banku is a Ghanaian dish made from fermented corn and cassava dough. It is usually shaped into a ball and served with a variety of fish dishes, soups, and stews. Banku is consumed by almost all Ghanaian tribes, and can be traced back to the tribes...",https://www.tasteatlas.com/banku/wheretoeat,,,,,https://www.tasteatlas.com/volta,Volta,n/a,,,,,,,,
https://www.tasteatlas.com/hkatenkwan,https://www.tasteatlas.com/content/layout/images/thumbnail-no-photo-4.jpg,12,Chicken Dish,https://www.tasteatlas.com/chicken-dishes,Hkatenkwan,"Hkatenkwan is a traditional chicken dish originating from Ghana. The dish is usually made with a combination of chicken pieces, onions, garlic, tomatoes, hot peppers, peanut butter or ground peanuts, oil, salt, pepper, and okra. The chicken is sea...",https://www.tasteatlas.com/hkatenkwan/wheretoeat,https://www.tasteatlas.com/Chicken,https://cdn.tasteatlas.com/images/ingredientgroups/cc2384e25f3c4d52be5abe779ef2ad9b.png?h=120&w=120,https://www.tasteatlas.com/Onions,https://cdn.tasteatlas.com/images/ingredientgroups/bf73aa24e1b745988f43388bbdd27322.png?h=120&w=120,,,n/a,https://www.tasteatlas.com/garlic,https://cdn.tasteatlas.com/images/ingredientgroups/5863714d901146c094f8228eb52c1fcb.png?h=120&w=120,https://www.tasteatlas.com/Tomatoes,https://cdn.tasteatlas.com/images/ingredientgroups/72ddcc5fa8d7439d9f190499aa559132.png?h=120&w=120,https://www.tasteatlas.com/Hot-peppers,https://cdn.tasteatlas.com/images/ingredientgroups/e02c316cda454fff9c282a56a480b458.png?h=120&w=120,https://www.tasteatlas.com/Peanut-butter,https://cdn.tasteatlas.com/images/ingredientgroups/6f7f150e3aae4b67b9b4102db715cba9.png?h=120&w=120
https://www.tasteatlas.com/akple,https://www.tasteatlas.com/content/layout/images/thumbnail-no-photo-4.jpg,13,Side Dish,https://www.tasteatlas.com/Sides,Akple,"Akple is a unique Ghanaian dish consisting of corn flour, cassava flour, water, and salt. The combination of these ingredients is usually rolled into a ball and left to ferment. The dish was invented by the Ewe tribe and is traditionally consumed ...",https://www.tasteatlas.com/akple/wheretoeat,,,,,https://www.tasteatlas.com/volta,Volta,n/a,,,,,,,,
https://www.tasteatlas.com/kpekpele,https://www.tasteatlas.com/content/layout/images/thumbnail-no-photo-4.jpg,14,Bread,https://www.tasteatlas.com/Breads,Kpekpele,Kpekpele is a traditional Ghanaian bread made by steaming fermented cornmeal. The unleavened bread is often consumed with a palm soup that features large amounts of smoked fish. It is traditionally served during the harvest festival known as Homow...,https://www.tasteatlas.com/kpekpele/wheretoeat,,,,,,,n/a,,,,,,,,
https://www.tasteatlas.com/tuo-zaafi,https://www.tasteatlas.com/content/layout/images/thumbnail-no-photo-3.jpg,15,Side Dish,https://www.tasteatlas.com/Sides,Tuo zaafi,"Tuo zaafi is a Northern Ghanaian dish made by cooking a combination of maize or millet flour and water. In the Hausa language,  means , and  means . Sticky, starchy, and full of carbohydrates, ...",https://www.tasteatlas.com/tuo-zaafi/wheretoeat,,,,,https://www.tasteatlas.com/northern-region-ghana,Northern Region,n/a,,,,,,,,
https://www.tasteatlas.com/konkonte,https://www.tasteatlas.com/content/layout/images/thumbnail-no-photo-3.jpg,16,Side Dish,https://www.tasteatlas.com/Sides,Konkonte,"Konkonte is a simple Ghanaian side dish made by cooking a kneaded combination of cassava flour and water. It is traditionally served hot with dishes such as groundnut, palm nut, or okra soup. Depending on the method of drying cassava, konkonte can...",https://www.tasteatlas.com/konkonte/wheretoeat,,,,,,,n/a,,,,,,,,
https://www.tasteatlas.com/akotonshi,https://www.tasteatlas.com/content/layout/images/thumbnail-no-photo-2.jpg,17,Crab Dish,https://www.tasteatlas.com/crab-dishes,Akotonshi,"Akotonshi is a traditional crab dish originating from Ghana. The dish is made with a combination of crab meat, ginger, onions, tomatoes, tomato paste, bell peppers, paprika, hot peppers, dried shrimp, breadcrumbs, parsley, oil, salt, and spices su...",https://www.tasteatlas.com/akotonshi/wheretoeat,https://www.tasteatlas.com/crabs,https://cdn.tasteatlas.com/images/ingredientgroups/37e8f7030f474704ac241bb0695a92f9.png?h=120&w=120,https://www.tasteatlas.com/Tomatoes,https://cdn.tasteatlas.com/images/ingredientgroups/72ddcc5fa8d7439d9f190499aa559132.png?h=120&w=120,,,n/a,https://www.tasteatlas.com/ginger,https://cdn.tasteatlas.com/images/ingredientgroups/5ca47b7a434e4703b27e14e381f9aaf4.png?h=120&w=120,https://www.tasteatlas.com/Onions,https://cdn.tasteatlas.com/images/ingredientgroups/bf73aa24e1b745988f43388bbdd27322.png?h=120&w=120,https://www.tasteatlas.com/bell-peppers,https://cdn.tasteatlas.com/images/ingredientgroups/0f922f485f1b427393a6cd5a69f66b6f.png?h=120&w=120,https://www.tasteatlas.com/tomato-pastes,https://cdn.tasteatlas.com/images/ingredientgroups/4284624f3cde451e9683452b5ccf0f21.png?h=120&w=120
https://www.tasteatlas.com/ghana-meatball-stew,https://www.tasteatlas.com/content/layout/images/thumbnail-no-photo-3.jpg,18,Stew,https://www.tasteatlas.com/Stews,Ghana Meatball Stew,"This meatball stew is a traditional dish originating from Ghana. It consists of meatballs that are simmered in vegetable-based gravy. The meatballs are usually made with a combination of ground beef, eggs, onions, salt, pepper, garlic, nutmeg, flo...",https://www.tasteatlas.com/ghana-meatball-stew/wheretoeat,https://www.tasteatlas.com/Beef,https://cdn.tasteatlas.com/images/ingredientgroups/3db7b6f60a934bc89f41a0c51acd08ac.png?h=120&w=120,https://www.tasteatlas.com/Eggs,https://cdn.tasteatlas.com/images/ingredientgroups/68062afe91e64f1ba087f7caf87a7fdb.png?h=120&w=120,,,n/a,https://www.tasteatlas.com/Onions,https://cdn.tasteatlas.com/images/ingredientgroups/bf73aa24e1b745988f43388bbdd27322.png?h=120&w=120,https://www.tasteatlas.com/garlic,https://cdn.tasteatlas.com/images/ingredientgroups/5863714d901146c094f8228eb52c1fcb.png?h=120&w=120,https://www.tasteatlas.com/Flour,https://cdn.tasteatlas.com/images/ingredientgroups/6980492bc1fb48d292831ababd8816c3.png?h=120&w=120,https://www.tasteatlas.com/nutmegs,https://cdn.tasteatlas.com/images/ingredientgroups/7ee6cd3c42294ee7a9b8fc3e2184ac56.png?h=120&w=120
https://www.tasteatlas.com/gari-foto,https://www.tasteatlas.com/content/layout/images/thumbnail-no-photo-4.jpg,19,Side Dish,https://www.tasteatlas.com/Sides,Gari foto,"Gari foto is a traditional Ghanaian dish made with gari (cassava mash), tomatoes, onions, carrots, green peppers, oil, margarine, and seasonings. When the dish is made with ingredients such as these, with the addition of vegetables, it's usually s...",https://www.tasteatlas.com/gari-foto/wheretoeat,,,,,,,n/a,,,,,,,,