search-results__item-image href,search-results__item-image src,similar-list__item-position,group,group href,h2,score-text,search-results__item-description,search-results__item-description 2,search-results__item-link href 2,mini-ingredients__link href,mini-ingredients__image src,mini-ingredients__link href 2,mini-ingredients__image src 2,mini-ingredients__or,mini-ingredients__link href 3,mini-ingredients__image src 3,mini-ingredients__link href 4,mini-ingredients__image src 4,mini-ingredients__link href 5,mini-ingredients__image src 5,score-text--na,item-location href,item-location,mini-ingredients__link href 6,mini-ingredients__image src 6
https://www.tasteatlas.com/baghali-ghatogh,https://cdn.tasteatlas.com//images/dishes/ffe5f41264f54bc4877edbc8163d3133.jpg?mw=660,80,Stew,https://www.tasteatlas.com/Stews,Baghali ghatogh,,"Baghali ghatogh is a traditional dish originating from northern Iran. The dish is usually made with a combination of lima beans, dill, eggs, butter, turmeric, garlic, saffron, salt, and pepper. The turmeric and garlic are cooked in butter until fr...",,https://www.tasteatlas.com/baghali-ghatogh/wheretoeat,https://www.tasteatlas.com/Lima-beans,https://cdn.tasteatlas.com/images/ingredientgroups/530a9ed460b644bd93ef03b25ed03476.png?h=120&w=120,https://www.tasteatlas.com/Eggs,https://cdn.tasteatlas.com/images/ingredientgroups/68062afe91e64f1ba087f7caf87a7fdb.png?h=120&w=120,,https://www.tasteatlas.com/dill,https://cdn.tasteatlas.com/images/ingredientgroups/8384c9ba7c584ab2901cac3361e56fea.png?h=120&w=120,https://www.tasteatlas.com/Butter,https://cdn.tasteatlas.com/images/ingredientgroups/82d84a396a544682bb2954283d8666e6.png?h=120&w=120,https://www.tasteatlas.com/garlic,https://cdn.tasteatlas.com/images/ingredientgroups/5863714d901146c094f8228eb52c1fcb.png?h=120&w=120,n/a,,,https://www.tasteatlas.com/turmeric,https://cdn.tasteatlas.com/images/ingredientgroups/fcf079fe2d5243b99979db6ebf5210de.png?h=120&w=120
https://www.tasteatlas.com/shirazi-salad,https://cdn.tasteatlas.com//images/dishes/7a08c182bc9b4e39a7fc03b688ca5a11.jpg?mw=660,81,Salad,https://www.tasteatlas.com/Salads,Shirazi Salad,,"Shirazi salad is a traditional Iranian salad made with cucumbers, tomatoes, onions, and lemon or lime juice. Cilantro, dried mint, and green peppers can be added to enhance the flavor and texture, if desired. The salad is named after Shiraz, a cit...",,https://www.tasteatlas.com/shirazi-salad/wheretoeat,https://www.tasteatlas.com/Cucumbers,https://cdn.tasteatlas.com/images/ingredientgroups/4130274c7033414bad32e0540631ff2d.png?h=120&w=120,https://www.tasteatlas.com/Tomatoes,https://cdn.tasteatlas.com/images/ingredientgroups/72ddcc5fa8d7439d9f190499aa559132.png?h=120&w=120,OR,https://www.tasteatlas.com/Onions,https://cdn.tasteatlas.com/images/ingredientgroups/bf73aa24e1b745988f43388bbdd27322.png?h=120&w=120,https://www.tasteatlas.com/Lemons,https://cdn.tasteatlas.com/images/ingredientgroups/e72116820fd94959b9d5e570b3df6316.png?h=120&w=120,https://www.tasteatlas.com/Limes,https://cdn.tasteatlas.com/images/ingredientgroups/64e50731ad814053bbaa3e63f1006784.png?h=120&w=120,n/a,https://www.tasteatlas.com/shiraz,Shiraz,https://www.tasteatlas.com/Peppers,https://cdn.tasteatlas.com/images/ingredientgroups/6907265facb2440399ccfa3e56381c45.png?h=120&w=120
https://www.tasteatlas.com/kabab-e-donbalan,https://www.tasteatlas.com/content/layout/images/thumbnail-no-photo-3.jpg,82,Offal Dish,https://www.tasteatlas.com/Offal,Kabab-e donbalan,,"Kabab-e donbalan is a traditional offal dish originating from Iran. This type of kebab is usually made with a combination of lamb testicles, lemon juice, olive oil, salt, and pepper. The testicles are cut lengthwise, then mixed with olive oil, lem...",,https://www.tasteatlas.com/kabab-e-donbalan/wheretoeat,https://www.tasteatlas.com/Lamb,https://cdn.tasteatlas.com/images/ingredientgroups/6303dec1aa394f72b07b8bf7e4572177.png?h=120&w=120,https://www.tasteatlas.com/lemon-juices,https://cdn.tasteatlas.com/images/ingredientgroups/bbcffe4057b045df86c02995facd36b3.png?h=120&w=120,,https://www.tasteatlas.com/Olive-oil,https://cdn.tasteatlas.com/images/ingredientgroups/51f74167400e4342a76839cfdaa89693.png?h=120&w=120,https://www.tasteatlas.com/Salt,https://cdn.tasteatlas.com/images/ingredientgroups/812de2786a274b7e85a4c54cc0fb40d2.png?h=120&w=120,https://www.tasteatlas.com/black-pepper,https://cdn.tasteatlas.com/images/ingredientgroups/deddb5ecf2b44e79a75ddcc05a5cc298.png?h=120&w=120,n/a,,,,
https://www.tasteatlas.com/kuku-gerdu,https://www.tasteatlas.com/content/layout/images/thumbnail-no-photo-1.jpg,83,Egg Dish,https://www.tasteatlas.com/egg-dishes,Kuku gerdu,,"Kuku gerdu is a traditional egg-based dish originating from the Caspian Sea region of Iran. This frittata-like dish is usually made with a combination of walnuts, potatoes, onions, eggs, parsley, dill, mint, chives, garlic, turmeric, oil, salt, an...",,https://www.tasteatlas.com/kuku-gerdu/wheretoeat,https://www.tasteatlas.com/Eggs,https://cdn.tasteatlas.com/images/ingredientgroups/68062afe91e64f1ba087f7caf87a7fdb.png?h=120&w=120,https://www.tasteatlas.com/Walnuts,https://cdn.tasteatlas.com/images/ingredientgroups/ba2b29e1021746729a5afa8899ff8d7b.png?h=120&w=120,,https://www.tasteatlas.com/Potatoes,https://cdn.tasteatlas.com/images/ingredientgroups/282779ae12bd41c8b1470862a313c360.png?h=120&w=120,https://www.tasteatlas.com/Onions,https://cdn.tasteatlas.com/images/ingredientgroups/bf73aa24e1b745988f43388bbdd27322.png?h=120&w=120,https://www.tasteatlas.com/parsley,https://cdn.tasteatlas.com/images/ingredientgroups/205f99273994439fb0e05fa744a9d98a.png?h=120&w=120,n/a,,,https://www.tasteatlas.com/dill,https://cdn.tasteatlas.com/images/ingredientgroups/8384c9ba7c584ab2901cac3361e56fea.png?h=120&w=120
https://www.tasteatlas.com/qurabiya,https://cdn.tasteatlas.com//images/dishes/a1cb08a307624594a50105dea797aa09.jpg?mw=660,84,Cookie,https://www.tasteatlas.com/Cookies,Qurabiya,,"The decorative qurabiyas are Iranian shortbread cookies made with ground blanched almonds, egg whites, sugar, and a small amount of flour. The batter is piped into circular shapes, and the cookies are then baked until crispy. Before they are put i...",,https://www.tasteatlas.com/qurabiya/wheretoeat,,,,,,,,,,,,n/a,https://www.tasteatlas.com/tabriz,Tabriz,,
https://www.tasteatlas.com/dal-adas,https://www.tasteatlas.com/content/layout/images/thumbnail-no-photo-3.jpg,85,Vegetable Dish,https://www.tasteatlas.com/Vegetable-dishes,Dal adas,,"Dal adas is a traditional vegetarian dish hailing from the southern Iranian port city of Bushehr, located on the Persian Gulf. Reminiscent of an Indian , this dish typically consists of red lentils which are simmered in vegetable stock...",dal,https://www.tasteatlas.com/dal-adas/wheretoeat,https://www.tasteatlas.com/Lentils,https://cdn.tasteatlas.com/images/ingredientgroups/54230c9c778849fb8b4742c78ee846ea.png?h=120&w=120,https://www.tasteatlas.com/stocks,https://cdn.tasteatlas.com/images/ingredientgroups/27990ac3f60a4812ad3aadf8f044cdb6.png?h=120&w=120,,https://www.tasteatlas.com/tamarind,https://cdn.tasteatlas.com/images/ingredientgroups/3bc14d735a994464870f3aae64819a42.png?h=120&w=120,https://www.tasteatlas.com/Potatoes,https://cdn.tasteatlas.com/images/ingredientgroups/282779ae12bd41c8b1470862a313c360.png?h=120&w=120,https://www.tasteatlas.com/Onions,https://cdn.tasteatlas.com/images/ingredientgroups/bf73aa24e1b745988f43388bbdd27322.png?h=120&w=120,n/a,https://www.tasteatlas.com/bushehr,Bushehr,https://www.tasteatlas.com/garlic,https://cdn.tasteatlas.com/images/ingredientgroups/5863714d901146c094f8228eb52c1fcb.png?h=120&w=120
https://www.tasteatlas.com/nan-e-kabab,https://cdn.tasteatlas.com//Images/Dishes/f7400776366b4b87aae63040d3e85789.jpg?mw=660,86,Ground Meat Dish,https://www.tasteatlas.com/ground-meat-dishes,Nan-e-kabab,,"Iranian nan-e-kabab is a term used for a variety of dishes that combine kebabs and traditional Iranian bread. Kebabs are usually prepared with lamb, beef, or chicken meat, while less common varieties employ marinated offal. The meat is usually acc...",,https://www.tasteatlas.com/nan-e-kabab/wheretoeat,https://www.tasteatlas.com/Beef,https://cdn.tasteatlas.com/images/ingredientgroups/3db7b6f60a934bc89f41a0c51acd08ac.png?h=120&w=120,https://www.tasteatlas.com/Chicken,https://cdn.tasteatlas.com/images/ingredientgroups/cc2384e25f3c4d52be5abe779ef2ad9b.png?h=120&w=120,OR,https://www.tasteatlas.com/Lamb,https://cdn.tasteatlas.com/images/ingredientgroups/6303dec1aa394f72b07b8bf7e4572177.png?h=120&w=120,https://www.tasteatlas.com/Onions,https://cdn.tasteatlas.com/images/ingredientgroups/bf73aa24e1b745988f43388bbdd27322.png?h=120&w=120,https://www.tasteatlas.com/coriander,https://cdn.tasteatlas.com/images/ingredientgroups/6070111d940042ddab6019a86951fc8b.png?h=120&w=120,n/a,,,https://www.tasteatlas.com/yogurt,https://cdn.tasteatlas.com/images/dishes/242742c498304e40a7500080f677c360.png?h=120&w=120
https://www.tasteatlas.com/mahyawa,https://www.tasteatlas.com/content/layout/images/thumbnail-no-photo-2.jpg,87,Sauce,https://www.tasteatlas.com/Sauces,Mahyawa,,"Originating from the southern regions of Iran, mahyawa is a traditional fish sauce with a tangy flavor. The sauce is made from salted anchovies and also contains fennel, coriander, cumin, and mustard seeds. It is traditionally served on top of khu...",,https://www.tasteatlas.com/mahyawa/wheretoeat,https://www.tasteatlas.com/anchovies,https://cdn.tasteatlas.com/images/ingredientgroups/9d1bd646966e4ee890a98352232dfc61.png?h=120&w=120,https://www.tasteatlas.com/fennel,https://cdn.tasteatlas.com/images/ingredientgroups/64c246113f4147b6a1bff6eae8667ae4.png?h=120&w=120,,https://www.tasteatlas.com/coriander,https://cdn.tasteatlas.com/images/ingredientgroups/6070111d940042ddab6019a86951fc8b.png?h=120&w=120,https://www.tasteatlas.com/cumin,https://cdn.tasteatlas.com/images/ingredientgroups/4249a750e5b54ffb8fb873a2c5463d06.png?h=120&w=120,https://www.tasteatlas.com/mustard-seeds,https://cdn.tasteatlas.com/images/ingredientgroups/4d03b99336144a789a8257a8cca3bf8d.png?h=120&w=120,n/a,,,https://www.tasteatlas.com/Salt,https://cdn.tasteatlas.com/images/ingredientgroups/812de2786a274b7e85a4c54cc0fb40d2.png?h=120&w=120
https://www.tasteatlas.com/shir-birinj,https://cdn.tasteatlas.com//Images/Dishes/10d7d3ff0c904bc792f22148a54dfc5b.jpg?mw=660,88,Dessert,https://www.tasteatlas.com/Desserts,Shir birinj,,"Shir birinj, meaning , is a simple, popular dessert enjoyed throughout Iran and Afghanistan. Traditionally, it was prepared only by cooking milk and rice, while today it commonly includes sugar. For the desired thickness and ...",milk and rice,https://www.tasteatlas.com/shir-birinj/wheretoeat,,,,,,,,,,,,n/a,,,,