search-results__item-image href,search-results__item-image src,similar-list__item-position,group,group href,h2,score-text,search-results__item-description,search-results__item-description 2,search-results__item-description 3,search-results__item-link href 2,mini-ingredients__link href,mini-ingredients__image src,mini-ingredients__link href 2,mini-ingredients__image src 2,mini-ingredients__link href 3,mini-ingredients__image src 3,mini-ingredients__link href 4,mini-ingredients__image src 4,similar-list__item-description,similar-list__item-description 2,similar-list__item-description href,mini-ingredients__link href 5,mini-ingredients__image src 5,mini-ingredients__link href 6,mini-ingredients__image src 6,score-text--na
https://www.tasteatlas.com/placinta-moldova,https://cdn.tasteatlas.com//images/dishes/7f1c72c24abc4f0b94c941358b9f1cda.jpg?mw=660,1,Savory Pastry,https://www.tasteatlas.com/savory-pastry,Plăcintă,4.6,"Plăcintă, from the Latin word  which means , is a traditional Romanian fried pastry or a thin cake consisting of flour, water, eggs, milk, yeast, and a pinch of salt. This fried or deep-fried pastry is enjoyed wa...",placenta,flat cake,https://www.tasteatlas.com/placinta-moldova/wheretoeat,https://www.tasteatlas.com/Flour,https://cdn.tasteatlas.com/images/ingredientgroups/6980492bc1fb48d292831ababd8816c3.png?h=120&w=120,https://www.tasteatlas.com/Eggs,https://cdn.tasteatlas.com/images/ingredientgroups/68062afe91e64f1ba087f7caf87a7fdb.png?h=120&w=120,https://www.tasteatlas.com/yeasts,https://cdn.tasteatlas.com/images/ingredientgroups/805b01e32cd74f6fbdc87146dbad384f.png?h=120&w=120,https://www.tasteatlas.com/Milk,https://cdn.tasteatlas.com/images/ingredientgroups/32cfca5acc5c40ef8daecc359371a43e.png?h=120&w=120,,,,,,,,
https://www.tasteatlas.com/mamaliga-moldova,https://cdn.tasteatlas.com//Images/Dishes/790793902f2841ec9422c4e0f09000c3.jpg?mw=660,2,Porridge,https://www.tasteatlas.com/Porridge,Mămăligă,4.0,"Mămăligă is a traditional Romanian porridge and the country's national dish that is often confused with polenta. It is an extremely simple dish of boiled cornmeal that was cooked mostly by peasants in the past, often acting as a substitute for bre...",,,https://www.tasteatlas.com/mamaliga-moldova/wheretoeat,,,,,,,,,Best in   (Chişinău),La Taifas,https://www.tasteatlas.com/la-taifas,,,,,
https://www.tasteatlas.com/sarmale-moldova,https://cdn.tasteatlas.com//images/dishes/abbef07b6054405a8b2305db7beca93e.jpg?mw=660,3,Ground Meat Dish,https://www.tasteatlas.com/ground-meat-dishes,Sarmale,4.4,"One of the staples of traditional Turkish cuisine, sarma consists of a filling that is snugly surrounded by leaves or leafy vegetables. There are numerous versions of this dish but the mixture typically combines ingredients such as minced meat, ri...",,,https://www.tasteatlas.com/sarmale-moldova/wheretoeat,https://www.tasteatlas.com/Beef,https://cdn.tasteatlas.com/images/ingredientgroups/3db7b6f60a934bc89f41a0c51acd08ac.png?h=120&w=120,https://www.tasteatlas.com/Lamb,https://cdn.tasteatlas.com/images/ingredientgroups/6303dec1aa394f72b07b8bf7e4572177.png?h=120&w=120,https://www.tasteatlas.com/Pork,https://cdn.tasteatlas.com/images/ingredientgroups/905dbdf1da5f4687bd091624f5e3180d.png?h=120&w=120,https://www.tasteatlas.com/Cabbages,https://cdn.tasteatlas.com/images/ingredientgroups/037403c6717345dfba27bed2dc805b5d.png?h=120&w=120,,,,https://www.tasteatlas.com/chard,https://cdn.tasteatlas.com/images/ingredientgroups/189e8669841a4f9c9c56f5b8498cbcd1.png?h=120&w=120,https://www.tasteatlas.com/Rice,https://cdn.tasteatlas.com/images/ingredientgroups/17d658e3b3964b849c47b9469c8e6465.png?h=120&w=120,
https://www.tasteatlas.com/zeama,https://cdn.tasteatlas.com//Images/Dishes/c2a053f3051e498684e6b98c28ff8e6a.jpg?mw=660,4,Chicken Soup,https://www.tasteatlas.com/chicken-soups,Zeama,4.8,"Zeama is a traditional Moldovan soup that is also known as the ultimate hangover cure. It typically consists of homemade chicken broth that’s prepared with a smaller whole chicken, water, thin homemade egg noodles (tăiței de casă), and a var...",,,https://www.tasteatlas.com/zeama/wheretoeat,https://www.tasteatlas.com/Chicken,https://cdn.tasteatlas.com/images/ingredientgroups/cc2384e25f3c4d52be5abe779ef2ad9b.png?h=120&w=120,https://www.tasteatlas.com/Noodles-shapes,https://cdn.tasteatlas.com/images/ingredientgroups/64cf9fef216e4d79b37daa17b903a4d2.png?h=120&w=120,https://www.tasteatlas.com/Carrots,https://cdn.tasteatlas.com/images/ingredientgroups/c497c7c9cd1447ebabf0565c1ef4387e.png?h=120&w=120,https://www.tasteatlas.com/Onions,https://cdn.tasteatlas.com/images/ingredientgroups/bf73aa24e1b745988f43388bbdd27322.png?h=120&w=120,Best in   (Chişinău),Vatra Neamului,https://www.tasteatlas.com/vatra-neamului,https://www.tasteatlas.com/bell-peppers,https://cdn.tasteatlas.com/images/ingredientgroups/0f922f485f1b427393a6cd5a69f66b6f.png?h=120&w=120,https://www.tasteatlas.com/leeks,https://cdn.tasteatlas.com/images/ingredientgroups/e5722e8831554305a7c507e79b4c3a99.png?h=120&w=120,
https://www.tasteatlas.com/parjoale,https://cdn.tasteatlas.com//images/dishes/df2e3c1db2dc41429fca0f3c922c5ce4.jpg?mw=660,5,Ground Meat Dish,https://www.tasteatlas.com/ground-meat-dishes,Pârjoale,,"are popular Moldovan and Romanian meat patties and meatballs made from lamb, pork, beef, or a combination of the three. The meat is usually combined with garlic, eggs, and fresh herbs such as dill, thyme, and parsley. These...",Pârjoale,,https://www.tasteatlas.com/parjoale/wheretoeat,,,,,,,,,,,,,,,,n/a
https://www.tasteatlas.com/sfintisori,https://cdn.tasteatlas.com//images/dishes/4e9355883f35476ba6d73613de692082.jpg?mw=660,6,Sweet Pastry,https://www.tasteatlas.com/sweet-pastry,Sfințișori,,"or  is a traditional dessert pastry coated in nuts and honey. The pastry is soft and fluffy on the interior, while the exterior is crispy, crunchy, and sticky. It is made in the form of figure eight, r...",Sfințișori,Moldavian martyrs,https://www.tasteatlas.com/sfintisori/wheretoeat,,,,,,,,,,,,,,,,n/a