search-results__item-image href,search-results__item-image src,similar-list__item-position,group,group href,h2,item-location href,item-location src,item-location,score-text,similar-list__item-description,similar-list__item-description 2,similar-list__item-description href,search-results__item-description,search-results__item-description 2,read-more,search-results__item-link href 2,mini-ingredients__link href,mini-ingredients__image src,mini-ingredients__link href 2,mini-ingredients__image src 2,mini-ingredients__link href 3,mini-ingredients__image src 3,mini-ingredients__link href 4,mini-ingredients__image src 4,mini-ingredients__link href 5,mini-ingredients__image src 5,mini-ingredients__link href 6,mini-ingredients__image src 6,score-text--na
https://www.tasteatlas.com/ulster-fry,https://cdn.tasteatlas.com//Images/Dishes/c32cdf6660554062ac67b6ace2bb6e1b.jpg?mw=660,104,Breakfast,https://www.tasteatlas.com/Breakfast,Ulster Fry,https://www.tasteatlas.com/northern-ireland,https://cdn.tasteatlas.com/images/emblems/67f3b4ce3b3348b6bd0fa89b23c2f1db.png,Northern Ireland,4.3,Best in   (Belfast),Brights Restaurant,https://www.tasteatlas.com/BrightsRestaurantHighHtreet,"Considered to be the ultimate breakfast food, Ulster fry is Northern Ireland's favorite dish consisting of sausages, streaky bacon, eggs and tomatoes, with the addition of griddle-baked soda farls (quarters) and potato bread, fried until golden cr...",,READ MORE,https://www.tasteatlas.com/ulster-fry/wheretoeat,,,,,,,,,,,,,
https://www.tasteatlas.com/deep-fried-mars-bar,https://cdn.tasteatlas.com//Images/Dishes/464e81d7ec8347bc9d20fdc14803ca4c.jpg?mw=660,105,Deep-fried Dessert,https://www.tasteatlas.com/deep-fried-desserts,Deep-Fried Mars Bar,https://www.tasteatlas.com/stonehaven,,"Stonehaven, Scotland",3.5,Best in   (Edinburgh),ClamShell,https://www.tasteatlas.com/ClamShell,"Deep-fried Mars bar is a famous Scottish delicacy and a champion of the jokingly-called , where the rule is that sugar, fat, and alcohol must each account for at least 30% of a person's daily caloric intake. The unusual snack...",Scottish Diet,READ MORE,https://www.tasteatlas.com/deep-fried-mars-bar/wheretoeat,,,,,,,,,,,,,
https://www.tasteatlas.com/jam-roly-poly,https://cdn.tasteatlas.com//images/dishes/77274bdca68c4cef929334b22b52c544.jpg?mw=660,106,Dessert,https://www.tasteatlas.com/Desserts,Jam Roly-Poly,https://www.tasteatlas.com/england,https://cdn.tasteatlas.com/images/emblems/2076f10d3a8048c2a2c5a03f02038538.png,England,4.1,Best in   (Hammersmith and Fulham),Thatched House,https://www.tasteatlas.com/thatched-house,"Jam roly-poly is a traditional British dessert consisting of a rolled-up suet pudding spread with fruit jam. It can be baked, boiled, or steamed, and it is usually served with custard. The dessert originates from the 19th century, when it was know...",,READ MORE,https://www.tasteatlas.com/jam-roly-poly/wheretoeat,,,,,,,,,,,,,
https://www.tasteatlas.com/welsh-cake,https://cdn.tasteatlas.com//images/dishes/d4391966d57e42778c0186be1a704a0c.jpg?mw=660,107,Dessert,https://www.tasteatlas.com/Desserts,Welsh Cake,https://www.tasteatlas.com/wales,https://cdn.tasteatlas.com/images/emblems/de43f414a022432faf1a5926bf477f28.png,Wales,4.1,Best in   (Cardiff),Fabulous Welshcakes,https://www.tasteatlas.com/fabulous-welshcakes,"Griddle-baked Welsh cakes are a traditional delicacy made with a simple base of flour, lard or butter, sugar, and eggs. They come in different regional varieties that often include spices, lemon zest, raisins, currants, and various types of flour....",,READ MORE,https://www.tasteatlas.com/welsh-cake/wheretoeat,,,,,,,,,,,,,
https://www.tasteatlas.com/roast-lamb-with-mint-sauce,https://cdn.tasteatlas.com//images/dishes/4a05a5c7ff384db8a37e59b2ddecd485.jpg?mw=660,108,Lamb/Mutton Dish,https://www.tasteatlas.com/lamb-and-mutton-dishes,Roast Lamb with Mint Sauce,https://www.tasteatlas.com/england,https://cdn.tasteatlas.com/images/emblems/2076f10d3a8048c2a2c5a03f02038538.png,England,4.0,Best in   (Seasalter),Sportsman,https://www.tasteatlas.com/sportsman,"This traditional British dish consists of roasted racks of lamb that are typically garnished with mint sprigs and paired with a flavorful mint sauce. The meat is usually flavored with Dijon mustard, salt, and pepper. The sauce consists of fresh mi...",,READ MORE,https://www.tasteatlas.com/roast-lamb-with-mint-sauce/wheretoeat,https://www.tasteatlas.com/Lamb,https://cdn.tasteatlas.com/images/ingredientgroups/6303dec1aa394f72b07b8bf7e4572177.png?h=120&w=120,https://www.tasteatlas.com/moutarde-de-dijon,https://cdn.tasteatlas.com/images/dishes/d09d00c1261e4a4898c25514f35bb67c.png?h=120&w=120,https://www.tasteatlas.com/mint,https://cdn.tasteatlas.com/images/ingredientgroups/b6c5042f1598417c8fa444f42310d56a.png?h=120&w=120,https://www.tasteatlas.com/shallots,https://cdn.tasteatlas.com/images/ingredientgroups/b754048f184446f79a4136e478886073.png?h=120&w=120,https://www.tasteatlas.com/Vinegar,https://cdn.tasteatlas.com/images/ingredientgroups/2dd31d3caa6049a486090f5204644be5.png?h=120&w=120,https://www.tasteatlas.com/black-pepper,https://cdn.tasteatlas.com/images/ingredientgroups/deddb5ecf2b44e79a75ddcc05a5cc298.png?h=120&w=120,
https://www.tasteatlas.com/neeps-and-tatties,https://cdn.tasteatlas.com//images/dishes/cd8aa6e2251b425db6f6b99183686420.jpg?mw=660,109,Potato Dish,https://www.tasteatlas.com/potato-dishes,Neeps and Tatties,https://www.tasteatlas.com/scotland,https://cdn.tasteatlas.com/images/emblems/8874a39214274a0ab487e92b829738bd.png,Scotland,3.7,Best in   (Edinburgh),Arcade Bar,https://www.tasteatlas.com/ArcadeBar,"Known in full as  and  - mashed swedes and chopped potatoes, respectively - this simple vegetable side dish is a true Scottish classic. Either steamed or boiled until tender, only separately, both the s...",bashed neeps,READ MORE,https://www.tasteatlas.com/neeps-and-tatties/wheretoeat,,,,,,,,,,,,,
https://www.tasteatlas.com/welsh-onion-cake,https://cdn.tasteatlas.com//Images/Dishes/778f215b764f4717a57bd48eeb41aaee.jpg?mw=660,110,Side Dish,https://www.tasteatlas.com/Sides,Welsh Onion Cake,https://www.tasteatlas.com/wales,https://cdn.tasteatlas.com/images/emblems/de43f414a022432faf1a5926bf477f28.png,Wales,,,,,"Welsh comfort food at its finest, this traditional onion cake - known in Wales as   or   - is made with layers of thinly sliced potatoes and soft onions topped with bits of butter or dre...",teisien,READ MORE,https://www.tasteatlas.com/welsh-onion-cake/wheretoeat,,,,,,,,,,,,,n/a
https://www.tasteatlas.com/brose,https://cdn.tasteatlas.com//images/dishes/854d1dc35ac3454ea5b36361b1ec27fb.jpg?mw=660,111,Porridge,https://www.tasteatlas.com/Porridge,Brose,https://www.tasteatlas.com/scotland,https://cdn.tasteatlas.com/images/emblems/8874a39214274a0ab487e92b829738bd.png,Scotland,,,,,"Originally, brose referred to a dish of oatmeal soaked in boiling water or milk, sometimes with a little butter stirred in for a richer flavor. Probably the simplest Scottish fare, depending on what was locally available, brose could be made with ...",,READ MORE,https://www.tasteatlas.com/brose/wheretoeat,,,,,,,,,,,,,n/a
https://www.tasteatlas.com/hard-sauce,https://cdn.tasteatlas.com//images/dishes/985868fd89d64103a98f61ef5c1b67ff.jpg?mw=660,112,Spread,https://www.tasteatlas.com/spreads,Hard Sauce,https://www.tasteatlas.com/england,https://cdn.tasteatlas.com/images/emblems/2076f10d3a8048c2a2c5a03f02038538.png,England,,,,,"Hard sauce is a traditional English accompaniment to plum pudding. Although it has the word sauce in its name, this concoction is actually more of a spread, made by beating sugar, butter, and flavorings such as brandy, rum, or whisky. The sugar ca...",,READ MORE,https://www.tasteatlas.com/hard-sauce/wheretoeat,https://www.tasteatlas.com/Butter,https://cdn.tasteatlas.com/images/ingredientgroups/82d84a396a544682bb2954283d8666e6.png?h=120&w=120,https://www.tasteatlas.com/Sugar,https://cdn.tasteatlas.com/images/ingredientgroups/ae857e2ec0504a6590b41c0000f6678c.png?h=120&w=120,https://www.tasteatlas.com/brandy,https://cdn.tasteatlas.com/images/dishes/fbdf6e159c1d4f65ab257f1783de3d8e.png?h=120&w=120,https://www.tasteatlas.com/rum,https://cdn.tasteatlas.com/images/dishes/7a2519c3071649deb754fcd426d36749.png?h=120&w=120,https://www.tasteatlas.com/whisky,https://cdn.tasteatlas.com/images/dishes/1aab7c26321f4752a80b251a72423854.png?h=120&w=120,,,n/a
https://www.tasteatlas.com/cawl-cennin,https://cdn.tasteatlas.com//Images/Dishes/adc15fa907164cb18c15036d0d85cffb.jpg?mw=660,113,Vegetable Soup,https://www.tasteatlas.com/vegetable-soups,Cawl Cennin,https://www.tasteatlas.com/wales,https://cdn.tasteatlas.com/images/emblems/de43f414a022432faf1a5926bf477f28.png,Wales,,,,,"The traditional Welsh leek and potato soup was once truly the poor man’s broth. Unlike the classic dish of Welsh lamb with leeks and root vegetables that anyone outside of Wales considers to be , this humble soup originally cont...",cawl,READ MORE,https://www.tasteatlas.com/cawl-cennin/wheretoeat,,,,,,,,,,,,,n/a
https://www.tasteatlas.com/champ,https://cdn.tasteatlas.com//images/dishes/4a8c30a461d141d79d6273b20799e8c5.jpg?mw=660,114,Potato Dish,https://www.tasteatlas.com/potato-dishes,Champ,https://www.tasteatlas.com/northern-ireland,https://cdn.tasteatlas.com/images/emblems/67f3b4ce3b3348b6bd0fa89b23c2f1db.png,Northern Ireland,,Best in   (Belfast),The Garrick,https://www.tasteatlas.com/the-garrick,"Also known as poundies and , this Irish comfort dish is made with mashed potatoes, spring onions, and copious amounts of butter and milk. Champ originates from the Ulster countryside where it was previously made with ...",brúitín,READ MORE,https://www.tasteatlas.com/champ/wheretoeat,,,,,,,,,,,,,n/a
https://www.tasteatlas.com/syllabub,https://cdn.tasteatlas.com//images/dishes/217fc0dc3bcd450d89310094fb0ac4cc.jpg?mw=660,115,Dessert,https://www.tasteatlas.com/Desserts,Syllabub,https://www.tasteatlas.com/england,https://cdn.tasteatlas.com/images/emblems/2076f10d3a8048c2a2c5a03f02038538.png,England,,Best in   (Westminster),Bancone,https://www.tasteatlas.com/bancone,"This light, sweet, alcoholic treat known as syllabub is a frothy combination of white wine, whipped cream, and sugar. The name of the dish is derived from the French term , an area in the Champagne region, and , denoting ...",Sille,READ MORE,https://www.tasteatlas.com/syllabub/wheretoeat,,,,,,,,,,,,,n/a
https://www.tasteatlas.com/rock-cakes,https://cdn.tasteatlas.com//images/dishes/6881932500a5423580ba5dd39af187cb.jpg?mw=660,116,Cookie,https://www.tasteatlas.com/Cookies,Rock Cakes,https://www.tasteatlas.com/england,https://cdn.tasteatlas.com/images/emblems/2076f10d3a8048c2a2c5a03f02038538.png,England,,Best in   (Brighton),Pavilion Gardens Cafe,https://www.tasteatlas.com/pavilion-gardens-cafe,"Rock cakes are traditional English cookies with a crumbly and light consistency, often served as a part of afternoon tea. The cookies are usually made with a combination of flour, sugar, baking powder, butter, eggs, vanilla extract, milk, and drie...",,READ MORE,https://www.tasteatlas.com/rock-cakes/wheretoeat,https://www.tasteatlas.com/Flour,https://cdn.tasteatlas.com/images/ingredientgroups/6980492bc1fb48d292831ababd8816c3.png?h=120&w=120,https://www.tasteatlas.com/Sugar,https://cdn.tasteatlas.com/images/ingredientgroups/ae857e2ec0504a6590b41c0000f6678c.png?h=120&w=120,https://www.tasteatlas.com/Eggs,https://cdn.tasteatlas.com/images/ingredientgroups/68062afe91e64f1ba087f7caf87a7fdb.png?h=120&w=120,https://www.tasteatlas.com/Butter,https://cdn.tasteatlas.com/images/ingredientgroups/82d84a396a544682bb2954283d8666e6.png?h=120&w=120,https://www.tasteatlas.com/dried-fruits,https://cdn.tasteatlas.com/images/ingredientgroups/5f33acf8bb8a41c19292969f322d304f.png?h=120&w=120,https://www.tasteatlas.com/Milk,https://cdn.tasteatlas.com/images/ingredientgroups/32cfca5acc5c40ef8daecc359371a43e.png?h=120&w=120,n/a
https://www.tasteatlas.com/devilled-kidneys,https://cdn.tasteatlas.com//Images/Dishes/95945f973c9642f1a59094e0f5754416.jpg?mw=660,117,Offal Dish,https://www.tasteatlas.com/Offal,Devilled Kidneys,https://www.tasteatlas.com/england,https://cdn.tasteatlas.com/images/emblems/2076f10d3a8048c2a2c5a03f02038538.png,England,,Best in   (Islington),St. John Bar and Restaurant,https://www.tasteatlas.com/StJohnBarAndRestaurant,"What was once a popular Victorian breakfast is nowadays a light lunch or a flavorful appetizer: the dish is called devilled kidneys, made by frying lamb kidneys in a rich, spicy sauce made with vinegar, mustard, Worcestershire sauce, a pinch of ca...",,READ MORE,https://www.tasteatlas.com/devilled-kidneys/wheretoeat,https://www.tasteatlas.com/organ-meats,https://cdn.tasteatlas.com/images/ingredientgroups/108bd41467d64291a9f31591dda75d8a.png?h=120&w=120,https://www.tasteatlas.com/worcestershire-sauce,https://cdn.tasteatlas.com/images/dishes/bd541fdde25746e991d836c691f315d2.png?h=120&w=120,https://www.tasteatlas.com/Mustard,https://cdn.tasteatlas.com/images/ingredientgroups/36f67695affa43ec9a0397a775614c85.png?h=120&w=120,https://www.tasteatlas.com/Vinegar,https://cdn.tasteatlas.com/images/ingredientgroups/2dd31d3caa6049a486090f5204644be5.png?h=120&w=120,https://www.tasteatlas.com/cayenne-pepper,https://cdn.tasteatlas.com/images/dishes/e2e04922bd2647f3a8cf147a736c34b5.png?h=120&w=120,https://www.tasteatlas.com/parsley,https://cdn.tasteatlas.com/images/ingredientgroups/205f99273994439fb0e05fa744a9d98a.png?h=120&w=120,n/a
https://www.tasteatlas.com/simnel-cake,https://cdn.tasteatlas.com//images/dishes/00f7de0ed7794c6e88717beed18ef078.jpg?mw=660,118,Cake,https://www.tasteatlas.com/cakes,Simnel Cake,https://www.tasteatlas.com/england,https://cdn.tasteatlas.com/images/emblems/2076f10d3a8048c2a2c5a03f02038538.png,England,,Best in   (Harrogate),Bettys Café Tea Rooms Harrogate,https://www.tasteatlas.com/BettysHarrogate,"Simnel cake is an English dessert that is traditionally prepared during the Easter festivities. The base is made with flour, butter, sugar, eggs, and (sometimes) milk. Once prepared, the batter is combined with dried fruit such as currants, sultan...",,READ MORE,https://www.tasteatlas.com/simnel-cake/wheretoeat,,,,,,,,,,,,,n/a
https://www.tasteatlas.com/clootie,https://cdn.tasteatlas.com//images/dishes/253980413a6c4cd69b87019ff6247898.jpg?mw=660,119,Pudding,https://www.tasteatlas.com/puddings,Clootie,https://www.tasteatlas.com/scotland,https://cdn.tasteatlas.com/images/emblems/8874a39214274a0ab487e92b829738bd.png,Scotland,,Best in   (Skye of Curr),Speyside Centre,https://www.tasteatlas.com/speyside-centre,"This traditional Scottish dessert, called either clootie or , is a sweet pudding steamed in a , meaning . Clootie is typically made with flour, breadcrumbs, dried fruit such as sultanas and curr...",clootie dumpling,READ MORE,https://www.tasteatlas.com/clootie/wheretoeat,,,,,,,,,,,,,n/a
https://www.tasteatlas.com/vegetable-roll,https://cdn.tasteatlas.com//images/dishes/a3d1e858fccf42a097e59320af3803ac.jpg?mw=660,120,Sausage,https://www.tasteatlas.com/Sausages,Vegetable Roll,https://www.tasteatlas.com/northern-ireland,https://cdn.tasteatlas.com/images/emblems/67f3b4ce3b3348b6bd0fa89b23c2f1db.png,Northern Ireland,,Best in   (Ballymena),Nobel Cafe,https://www.tasteatlas.com/nobel-cafe,"Although the name might suggest otherwise, vegetable roll is a beef product that is shaped like a large sausage. It is lightly seasoned with fresh herbs and spring onions. Fried or sliced and grilled, vegetable roll is a staple of Ulster Fry, but ...",,READ MORE,https://www.tasteatlas.com/vegetable-roll/wheretoeat,,,,,,,,,,,,,n/a
https://www.tasteatlas.com/chip-butty,https://cdn.tasteatlas.com//images/dishes/5108a8e778a94df1ad42baa4c5a27a81.jpg?mw=660,121,Sandwich,https://www.tasteatlas.com/sandwiches,Chip Butty,,,,,Best in   (Liverpool),Mowgli Street Food,https://www.tasteatlas.com/mowgli-street-food,"Chip butty is a British sandwich consisting of chips (fries) between bread that's slathered with butter (hence the butty in the name). Although purists might think that nothing else is needed, some people like to add condiments such as malt vinega...",,READ MORE,https://www.tasteatlas.com/chip-butty/wheretoeat,,,,,,,,,,,,,n/a
https://www.tasteatlas.com/scotch-broth,https://cdn.tasteatlas.com//images/dishes/d00f808dc2994774974ff5ddd8aa9c22.jpg?mw=660,122,Soup,https://www.tasteatlas.com/Soups,Scotch Broth,https://www.tasteatlas.com/scotland,https://cdn.tasteatlas.com/images/emblems/8874a39214274a0ab487e92b829738bd.png,Scotland,,Best in   (Edinburgh),Scran and Scallie,https://www.tasteatlas.com/scran-and-scallie,"Scotch broth is a hearty soup made with lamb meat, pearl barley, and an assortment of vegetables such as leeks, onions, carrots, and peas. Traditionally, the soup was especially popular on New Year's Day and on cold winter days. During those times...",,READ MORE,https://www.tasteatlas.com/scotch-broth/wheretoeat,https://www.tasteatlas.com/Lamb,https://cdn.tasteatlas.com/images/ingredientgroups/6303dec1aa394f72b07b8bf7e4572177.png?h=120&w=120,https://www.tasteatlas.com/Carrots,https://cdn.tasteatlas.com/images/ingredientgroups/c497c7c9cd1447ebabf0565c1ef4387e.png?h=120&w=120,https://www.tasteatlas.com/Onions,https://cdn.tasteatlas.com/images/ingredientgroups/bf73aa24e1b745988f43388bbdd27322.png?h=120&w=120,https://www.tasteatlas.com/Turnips,https://cdn.tasteatlas.com/images/ingredientgroups/e063a9431e8f4714b9ef42b808482935.png?h=120&w=120,https://www.tasteatlas.com/Celeries,https://cdn.tasteatlas.com/images/ingredientgroups/b9d0fcf664294ab78c4b05feeed690b9.png?h=120&w=120,https://www.tasteatlas.com/leeks,https://cdn.tasteatlas.com/images/ingredientgroups/e5722e8831554305a7c507e79b4c3a99.png?h=120&w=120,n/a
https://www.tasteatlas.com/dundee-cake,https://cdn.tasteatlas.com//images/dishes/7d403907beb2460bab763cc248025fb9.jpg?mw=660,123,Cake,https://www.tasteatlas.com/cakes,Dundee Cake,https://www.tasteatlas.com/dundee,,"Dundee, Scotland",,Best in   (Dundee),Fisher & Donaldson,https://www.tasteatlas.com/fisher--donaldson,"The traditional Scottish almond-studded fruitcake with cherries, sultanas, and candied peel, known as Dundee cake originated in the city of Dundee while its name appears to have been first recorded in the late 19th century. Interestingly, the cake...",,READ MORE,https://www.tasteatlas.com/dundee-cake/wheretoeat,https://www.tasteatlas.com/Almonds,https://cdn.tasteatlas.com/images/ingredientgroups/c6587193e7734331b4f484c821ccbede.png?h=120&w=120,https://www.tasteatlas.com/sultana-raisins,https://cdn.tasteatlas.com/images/ingredientgroups/29dcd43383ff4d119befdd5af17bc97c.png?h=120&w=120,https://www.tasteatlas.com/sherry,https://cdn.tasteatlas.com/images/dishes/f6eeef52a47145ce9a81e43e128e8af8.png?h=120&w=120,https://www.tasteatlas.com/candied-fruits,https://cdn.tasteatlas.com/images/ingredientgroups/67dc574c51ff46928cd365916d4e3501.png?h=120&w=120,https://www.tasteatlas.com/Oranges,https://cdn.tasteatlas.com/images/ingredientgroups/97233a9e84cb4d268005d5954060664b.png?h=120&w=120,https://www.tasteatlas.com/Raisins,https://cdn.tasteatlas.com/images/ingredientgroups/24b73f40527d4dd0967bba896ecb3696.png?h=120&w=120,n/a
https://www.tasteatlas.com/tipsy-laird,https://cdn.tasteatlas.com//Images/Dishes/33e6b019c87742a9a23e4d108c266c38.jpg?mw=660,124,Dessert,https://www.tasteatlas.com/Desserts,Tipsy Laird,https://www.tasteatlas.com/scotland,https://cdn.tasteatlas.com/images/emblems/8874a39214274a0ab487e92b829738bd.png,Scotland,,Best in   (Glasgow),Loks Bar & Kitchen,https://www.tasteatlas.com/loks-bar--kitchen,"This rich Scottish dessert flavored with whisky or Drambuie is a softer, more flavorful version of the traditional English sherry trifle. Tipsy laird (also known as ) typically consists of a sponge cake base that is layered...",Scottish trifle,READ MORE,https://www.tasteatlas.com/tipsy-laird/wheretoeat,,,,,,,,,,,,,n/a
https://www.tasteatlas.com/parkin,https://cdn.tasteatlas.com//Images/Dishes/7645436dbedc42e9ae708f2482016375.jpg?mw=660,125,Cake,https://www.tasteatlas.com/cakes,Parkin,https://www.tasteatlas.com/yorkshire-and-the-humber,,"Yorkshire and the Humber, England",,Best in   (Brighouse),Lottie Shaw's,https://www.tasteatlas.com/lottie-shaws,"Parkin or  is a sticky cake originating from Northern England, although it is mostly associated with Yorkshire. It consists of flour, oatmeal, black treacle, and either lard or butter. Many cooks like to spice it up with a hefty dos...",perkin,READ MORE,https://www.tasteatlas.com/parkin/wheretoeat,,,,,,,,,,,,,n/a
https://www.tasteatlas.com/finnan-haddie,https://cdn.tasteatlas.com//Images/Dishes/79a7a332df5140a48c143d89bd1d77fe.jpg?mw=660,126,Saltwater Fish Dish,https://www.tasteatlas.com/saltwater-fish-dishes,Finnan Haddie,https://www.tasteatlas.com/findon,,"Findon, Scotland",,Best in   (Glasgow),Red Onion Glasgow,https://www.tasteatlas.com/red-onion-glasgow,"Finnan haddie is a Scottish delicacy of cold smoked, flavored haddock. The fish is often roasted or grilled over high heat, but it can also be poached in milk and served for breakfast. It is believed that the dish was originally called",Findon ...,READ MORE,https://www.tasteatlas.com/finnan-haddie/wheretoeat,,,,,,,,,,,,,n/a
https://www.tasteatlas.com/potato-scone,https://cdn.tasteatlas.com//Images/Dishes/a4951083d4c645d78a7af3b20ee9daeb.jpg?mw=660,127,Sweet Bread,https://www.tasteatlas.com/Sweet-breads,Potato Scone,https://www.tasteatlas.com/scotland,https://cdn.tasteatlas.com/images/emblems/8874a39214274a0ab487e92b829738bd.png,Scotland,3.9,Best in   (Edinburgh),Broughton Delicatessen,https://www.tasteatlas.com/broughton-delicatessen,"An essential part of every  breakfast, potato scone - or , as they call it in Scotland - is a regional variant of the savory griddle scone made with mashed potatoes, butter, and flour. Even though tattie ...",full Scottish,READ MORE,https://www.tasteatlas.com/potato-scone/wheretoeat,https://www.tasteatlas.com/Potatoes,https://cdn.tasteatlas.com/images/ingredientgroups/282779ae12bd41c8b1470862a313c360.png?h=120&w=120,https://www.tasteatlas.com/Butter,https://cdn.tasteatlas.com/images/ingredientgroups/82d84a396a544682bb2954283d8666e6.png?h=120&w=120,https://www.tasteatlas.com/Flour,https://cdn.tasteatlas.com/images/ingredientgroups/6980492bc1fb48d292831ababd8816c3.png?h=120&w=120,,,,,,,
https://www.tasteatlas.com/birmingham-balti,https://cdn.tasteatlas.com//Images/Dishes/542c2aa50a4640038428b7ac0104e876.jpg?mw=660,128,Stew,https://www.tasteatlas.com/Stews,Birmingham Balti,https://www.tasteatlas.com/birmingham,,"Birmingham, England",4.1,Best in   (Birmingham),Al Frash,https://www.tasteatlas.com/AlFrash,"Birmingham balti is a curry variety prepared with meat, vegetables or fish, served in a traditional steel bowl in which it was cooked. It is usually paired with naan bread on the side. Although it falls under the category of Indian curries, it is ...",,READ MORE,https://www.tasteatlas.com/birmingham-balti/wheretoeat,,,,,,,,,,,,,
https://www.tasteatlas.com/traditional-cumberland-sausage,https://cdn.tasteatlas.com//images/dishes/2d4de3238f034df997aa397d3727fed4.jpg?mw=660,129,Sausage,https://www.tasteatlas.com/Sausages,Traditional Cumberland Sausage,https://www.tasteatlas.com/cumbria,https://cdn.tasteatlas.com/images/emblems/2076f10d3a8048c2a2c5a03f02038538.png,"Cumbria, England",4.6,Best in   (Cow Brow),The Plough at Lupton,https://www.tasteatlas.com/the-plough-at-lupton,"What differentiates  sausages from other sausages is their distinctively long and coiled shape. This English delicacy is pink in color, made from seasoned pork, and has a coarse texture. It consists of several basic ...",Traditional Cumberland,READ MORE,https://www.tasteatlas.com/traditional-cumberland-sausage/wheretoeat,,,,,,,,,,,,,
https://www.tasteatlas.com/potted-shrimps,https://cdn.tasteatlas.com//Images/Dishes/d3dc1b80739b48dbb5d4188f6a9cc746.jpg?mw=660,130,Shrimp/Prawn Dish,https://www.tasteatlas.com/shrimps-and-prawns,Potted Shrimps,https://www.tasteatlas.com/lancashire,https://cdn.tasteatlas.com/images/emblems/2076f10d3a8048c2a2c5a03f02038538.png,"Lancashire, England",3.6,Best in   (Westminster),Rules Restaurant,https://www.tasteatlas.com/RulesRestaurant,"Potted shrimps is a traditional British meal that is usually made with , although any small type of shrimp can be used in the dish. The shrimps are boiled in seawater, and then cooked in clarified butter. Additionally,...",Morecambe bay shrimp,READ MORE,https://www.tasteatlas.com/potted-shrimps/wheretoeat,,,,,,,,,,,,,
https://www.tasteatlas.com/shrewsbury-cakes,https://cdn.tasteatlas.com//images/dishes/d1f94acacf154afc8e500756606be23d.jpg?mw=660,131,Cookie,https://www.tasteatlas.com/Cookies,Shrewsbury Cakes,https://www.tasteatlas.com/shrewsbury,https://cdn.tasteatlas.com/images/emblems/2076f10d3a8048c2a2c5a03f02038538.png,"Shrewsbury, England",,,,,"This classic English shortbread biscuit takes its name after its place of origin, although different versions can be found in many other parts of England. While some use lemon, cinnamon, or even caraway seeds, the earliest recorded recipe goes bac...",,READ MORE,https://www.tasteatlas.com/shrewsbury-cakes/wheretoeat,,,,,,,,,,,,,n/a
https://www.tasteatlas.com/brandy-snaps,https://cdn.tasteatlas.com//images/dishes/c8a0903f03f64b2ea439dd60ccfbbce4.jpg?mw=660,132,Dessert,https://www.tasteatlas.com/Desserts,Brandy Snaps,https://www.tasteatlas.com/england,https://cdn.tasteatlas.com/images/emblems/2076f10d3a8048c2a2c5a03f02038538.png,England,3.8,,,,"Brandy snaps is a British sweet treat consisting of sweet tubular casings that are traditionally served filled with whipped cream. These little tubular rolls are usually made with a combination of golden syrup, butter, flour, ginger, sugar, lemon ...",,READ MORE,https://www.tasteatlas.com/brandy-snaps/wheretoeat,,,,,,,,,,,,,
