search-results__item-image href,search-results__item-image src,similar-list__item-position,group,group href,h2,search-results__item-description,search-results__item-description 2,search-results__item-link href 2,score-text--na,mini-ingredients__link href,mini-ingredients__image src,mini-ingredients__link href 2,mini-ingredients__image src 2,mini-ingredients__link href 3,mini-ingredients__image src 3,mini-ingredients__link href 4,mini-ingredients__image src 4
https://www.tasteatlas.com/nshima,https://cdn.tasteatlas.com//images/dishes/f040ec5dd81a4d368f0990ca43794894.jpg?mw=660,1,Porridge,https://www.tasteatlas.com/Porridge,Nshima,"Nshima is a staple food in Zambia – a very thick and smooth porridge made from ground maize. It is quite similar to the Kenyan  and the Zimbabwean . Nshima is always consumed with soups, sauces, or stews, known as...",ugali,https://www.tasteatlas.com/nshima/wheretoeat,,,,,,,,,
https://www.tasteatlas.com/ndiwo,https://www.tasteatlas.com/content/layout/images/thumbnail-no-photo-4.jpg,2,Vegetable Dish,https://www.tasteatlas.com/Vegetable-dishes,Ndiwo,"Ndiwo is a simple Zambian dish that is typically prepared with various leafy green vegetables, onions, and optionally tomatoes. The choice of greens may include anything from cassava leaves, collard greens, pumpkin leaves, pea leaves, bean leaves,...",,https://www.tasteatlas.com/ndiwo/wheretoeat,n/a,,,,,,,,
https://www.tasteatlas.com/delele,https://cdn.tasteatlas.com//images/dishes/eb73bad56ce24e369df8e09f88e7b6ea.jpg?mw=660,3,Stew,https://www.tasteatlas.com/Stews,Delele,"In Zambia, the term delele denotes okra, but also a simple dish that incorporates this traditional vegetable. The dish is predominately prepared with fresh okra that is cooked in water, alongside sliced tomatoes. Bicarbonate of soda is considered ...",,https://www.tasteatlas.com/delele/wheretoeat,n/a,https://www.tasteatlas.com/Okras,https://cdn.tasteatlas.com/images/ingredientgroups/3e3df0ccbd2442e19dbf2177d5c5c616.png?h=120&w=120,https://www.tasteatlas.com/baking-soda,https://cdn.tasteatlas.com/images/ingredientgroups/eed7d6a3369340d6a1c6218e16f6cbe4.png?h=120&w=120,https://www.tasteatlas.com/black-pepper,https://cdn.tasteatlas.com/images/ingredientgroups/deddb5ecf2b44e79a75ddcc05a5cc298.png?h=120&w=120,https://www.tasteatlas.com/Salt,https://cdn.tasteatlas.com/images/ingredientgroups/812de2786a274b7e85a4c54cc0fb40d2.png?h=120&w=120
https://www.tasteatlas.com/kalembula,https://cdn.tasteatlas.com//images/dishes/38f48a430a9f42b99cb73180bf832d40.jpg?mw=660,4,Vegetable Dish,https://www.tasteatlas.com/Vegetable-dishes,Kalembula,"Kalembula is a traditional Zambian  dish prepared with sweet potato leaves, tomatoes, onions, and pounded groundnuts. The combination of these ingredients is cooked in water until the dish develops a thick consistency. Just like othe...",ndiwo,https://www.tasteatlas.com/kalembula/wheretoeat,n/a,https://www.tasteatlas.com/Sweet-potatoes,https://cdn.tasteatlas.com/images/ingredientgroups/79d9c7e3ce1c4d81b1c725b1336df5f9.png?h=120&w=120,https://www.tasteatlas.com/Onions,https://cdn.tasteatlas.com/images/ingredientgroups/bf73aa24e1b745988f43388bbdd27322.png?h=120&w=120,https://www.tasteatlas.com/nuts,https://cdn.tasteatlas.com/images/ingredientgroups/0641a2da3cfe4d998fced5b092b43999.png?h=120&w=120,,
https://www.tasteatlas.com/ifisashi,https://www.tasteatlas.com/content/layout/images/thumbnail-no-photo-4.jpg,5,Vegetable Dish,https://www.tasteatlas.com/Vegetable-dishes,Ifisashi,"Ifisashi is a traditional Zambian dish made with peanuts, tomatoes, onions, and greens such as pumpkin leaves, sweet potato leaves, spinach, and collard greens. The ingredients are cooked until the peanut sauce achieves a desired, thick consistenc...",,https://www.tasteatlas.com/ifisashi/wheretoeat,n/a,https://www.tasteatlas.com/Peanuts,https://cdn.tasteatlas.com/images/ingredientgroups/2880e31ec7bc4b538f2d2884786b69c3.png?h=120&w=120,https://www.tasteatlas.com/Onions,https://cdn.tasteatlas.com/images/ingredientgroups/bf73aa24e1b745988f43388bbdd27322.png?h=120&w=120,https://www.tasteatlas.com/spinach,https://cdn.tasteatlas.com/images/ingredientgroups/2218c5aa26ab49168e768f4bc72feddd.png?h=120&w=120,https://www.tasteatlas.com/Collard-greens,https://cdn.tasteatlas.com/images/ingredientgroups/f987830f4261492286dab34d44b81abe.png?h=120&w=120
https://www.tasteatlas.com/chikanda,https://cdn.tasteatlas.com//images/dishes/b5d870538e724078a050eaeafa5874d3.jpeg?mw=660,6,Snack,https://www.tasteatlas.com/Snacks,Chikanda,"This Zambian snack is prepared with a tuber of chikanda orchids. The small-sized tubers are dried and pounded, and then combined with a thick mixture of peanuts and dry chili peppers. Chikanda is often referred to as , becau...",African polony,https://www.tasteatlas.com/chikanda/wheretoeat,n/a,,,,,,,,
https://www.tasteatlas.com/chibwabwa,https://www.tasteatlas.com/content/layout/images/thumbnail-no-photo-1.jpg,7,Side Dish,https://www.tasteatlas.com/Sides,Chibwabwa,"Chibwabwa is a typical Zambian dish cooked throughout the country. It consists of tomatoes, onions, pumpkin leaves, and (optionally) groundnuts. The ingredients are boiled in water until the combination becomes thick in texture. In Zambia, chibwab...",,https://www.tasteatlas.com/chibwabwa/wheretoeat,n/a,https://www.tasteatlas.com/Onions,,https://www.tasteatlas.com/Pumpkins,,https://www.tasteatlas.com/nuts,,,
https://www.tasteatlas.com/curried-gazelle,https://www.tasteatlas.com/content/layout/images/thumbnail-no-photo-4.jpg,8,Stew,https://www.tasteatlas.com/Stews,Curried Gazelle,"This dish originates from land-locked Zambia, where animals such as gazelles freely roam on the vast land, so it is not a surprise that a curry made with good-quality gazelle meat is quite popular in the country. The dish is made with gazelle rump...",,https://www.tasteatlas.com/curried-gazelle/wheretoeat,n/a,,,,,,,,