search-results__item-image href,search-results__item-image src,similar-list__item-position,group,group href,h2,search-results__item-description,search-results__item-link href 2,search-results__item-description 2,search-results__item-description 3
https://www.tasteatlas.com/dovi,https://www.tasteatlas.com/content/layout/images/thumbnail-no-photo-3.jpg,1,Stew,https://www.tasteatlas.com/Stews,Dovi,"Dovi is a traditional peanut stew from Zimbabwe made with crushed peanuts, garlic, onions, okra, vegetables such as carrots or potatoes, and stock or other liquids. The dish can be made with or without meat, typically chicken, goat, or lamb. It is...",https://www.tasteatlas.com/dovi/wheretoeat,,
https://www.tasteatlas.com/muboora,https://cdn.tasteatlas.com//images/dishes/25adf3d4153148109d9c600cfdab016a.jpg?mw=660,2,Stew,https://www.tasteatlas.com/Stews,Muboora,"Muboora is a traditional African dish hailing from Zimbabwe. It's made with a combination of pumpkin leaves, oil, tomatoes, onions, salt, and soda bicarbonate. The pumpkin leaves need to be washed carefully as they're usually full of soil. They ar...",https://www.tasteatlas.com/muboora/wheretoeat,,
https://www.tasteatlas.com/sadza,https://cdn.tasteatlas.com//images/dishes/241cf94d287048bb88bc2559e33ac266.jpg?mw=660,3,Porridge,https://www.tasteatlas.com/Porridge,Sadza,"Sadza is a traditional porridge originating from Zimbabwe, consisting of cornmeal and water. The name  means , and, in accordance, it can be served at any time of the day, whether for breakfast, lunch, or dinner. The cor...",https://www.tasteatlas.com/sadza/wheretoeat,sadza,meal
https://www.tasteatlas.com/chikenduza,https://www.tasteatlas.com/content/layout/images/thumbnail-no-photo-1.jpg,4,Cake,https://www.tasteatlas.com/cakes,Chikenduza,"Chikenduza is a traditional African dessert hailing from Zimbabwe. These candy cakes are made with a combination of flour, butter, vanilla, milk, sugar, yeast, eggs, salt, powdered sugar, and red food coloring. The dough is rolled into balls and b...",https://www.tasteatlas.com/chikenduza/wheretoeat,,
https://www.tasteatlas.com/mupunga-unedovi,https://www.tasteatlas.com/content/layout/images/thumbnail-no-photo-2.jpg,5,Rice Dish,https://www.tasteatlas.com/Rice-dishes,Mupunga unedovi,"Mupunga unedovi is a traditional African dish originating from Zimbabwe. This simple dish is made with a combination of only three ingredients: long grain rice, peanut butter, and salt. The rice is cooked in water until it soaks up the liquid, and...",https://www.tasteatlas.com/mupunga-unedovi/wheretoeat,,